{
  "kind": "publication",
  "round_id": "r2",
  "actor": {
    "client": "Codex desktop",
    "cli_version": "not exposed",
    "model": "GPT-6",
    "session": "vs2-interaction-2026-09-20"
  },
  "payload": {
    "stage": "owner_review_ready",
    "pr": "https://github.com/FinnNk/Meerkritic/pull/13",
    "head": "a2580a0785ab109c6014e404a949f60722282844",
    "base": "ff9af2e68d989590ebe030002e2e3789c35efef0",
    "archive_commit": "347a6788f00bc46852dae36dba0c0d49c2580c12",
    "archive_branch": "evidence/vs2-interaction-r2",
    "hosted_qualification": {
      "required_status_contexts": [],
      "observed_rollup": [],
      "note": "Current repository rules require owner review/resolution, not hosted CI; no hosted CI execution is claimed."
    },
    "owner_approval": false,
    "integrated": false,
    "licence_detection": "unconfirmed; published bytes verified; see licence-verification.json",
    "records": [
      "published-pr.json",
      "published-refs.txt",
      "host-rules.json",
      "published-pr.json",
      "verification-summary.json",
      "review.json",
      "equivalence.json"
    ]
  }
}