{
  "kind": "publication",
  "round_id": "r2",
  "actor": {
    "client": "Codex desktop",
    "cli_version": "not exposed",
    "model": "GPT-6",
    "session": "/root"
  },
  "payload": {
    "stage": "owner_review_ready",
    "pr": "https://github.com/FinnNk/Meerkritic/pull/15",
    "head": "1d56877f0ccc434344a0e67b42859f4744524767",
    "base": "cd0a4d8c9a254e3027513274b39ce3f65cf227d2",
    "archive_commit": "152c5af041a99fdff3a6bbcbce0cb5a99ae10155",
    "hosted_qualification": {
      "required_contexts": [],
      "observed_rollup": [],
      "note": "Repository rules require owner review/resolution, not hosted CI. No hosted CI run claimed."
    },
    "owner_approval": false,
    "integrated": false,
    "evidence": [
      "published-pr.json",
      "published-refs.txt",
      "host-rules.json",
      "verification-summary.json",
      "review.json",
      "equivalence.json"
    ]
  }
}